{
  "Arn": "arn:aws:service:us-east-1:123456789012:resource/example",
  "Authorization": "example-value",
  "ChannelId": "id-abc123",
  "CmafPackage": "example-value",
  "CreatedAt": "example-value",
  "DashPackage": "example-value",
  "Description": "example-value",
  "HlsPackage": "example-value",
  "Id": "id-abc123",
  "ManifestName": "example-resource",
  "MssPackage": "example-value",
  "Origination": "example-value",
  "StartoverWindowSeconds": "example-value",
  "Tags": "example-value",
  "TimeDelaySeconds": "example-value",
  "Url": "example-value",
  "Whitelist": "example-value"
}